web-scraper-order,web-scraper-start-url,pagination,pagination-href,recip,recip-href,name,ingr_list,meth_list,meth_group,ing_group
"1614336262-4954","https://www.bbcgoodfood.com/recipes/collection/easy-summer-recipes","","","Roasted asparagus & pea salad","https://www.bbcgoodfood.com/recipes/roasted-asparagus-pea-salad","Roasted asparagus & pea salad","","","[{""meth_group"":""STEP 1""},{""meth_group"":""Heat oven to 220C/200C fan/gas 7. Mix the yogurt, mustard and honey together. Add the lemon zest, then add the juice and some seasoning to taste. Squeeze any remaining lemon juice over the watercress.""},{""meth_group"":""STEP 2""},{""meth_group"":""Tear the bread into rough chunks and put them on a large roasting tray with the asparagus. Toss both in the rapeseed oil and seasoning, and roast for 10 mins until the asparagus is tender and croutons are golden.""},{""meth_group"":""STEP 3""},{""meth_group"":""Meanwhile, cook the eggs in a pan of boiling water for 6 mins, then add the frozen peas and cook for 1 min more. Drain and rinse both under cold water until cool. Peel the eggs, then cut into quarters.""},{""meth_group"":""STEP 4""},{""meth_group"":""To assemble, mix the asparagus and peas through the watercress, then toss through the creamy dressing. Nestle in the eggs and croutons, and serve.""}]","[{""ing_group"":""3 tbsp natural yogurt""},{""ing_group"":""1 tsp wholegrain mustard""},{""ing_group"":""½ tsp honey""},{""ing_group"":""½ lemon , zested and juiced""},{""ing_group"":""100g watercress""},{""ing_group"":""1 large slice sourdough bread""},{""ing_group"":""200g asparagus , tough ends removed""},{""ing_group"":""1 ½ tbsp cold-pressed rapeseed oil""},{""ing_group"":""2 eggs""},{""ing_group"":""200g frozen peas""}]"
"1614336258-4953","https://www.bbcgoodfood.com/recipes/collection/easy-summer-recipes","","","Mix & match seafood tacos","https://www.bbcgoodfood.com/recipes/mix-match-seafood-tacos","","","[{""meth_list"":""STEP 1""},{""meth_list"":""For the salmon, combine all the ingredients, except the avocado and seaweed, in a bowl and mix well. Cover and leave to marinate in the fridge while you prepare the other ingredients.""},{""meth_list"":""STEP 2""},{""meth_list"":""For the prawns, heat the olive oil in a pan over a high heat. Add the garlic, ginger, spring onions and chilli, stirring into the oil for 20 secs. Add the prawns and stir constantly until cooked through and pink. Remove from the heat and stir through the lime zest and juice.""},{""meth_list"":""STEP 3""},{""meth_list"":""Stir the avocado into the salmon and warm the taco shells following pack instructions. Fill each taco with the prawns or the salmon. Top the salmon tacos with the seaweed and the prawn tacos with coriander and extra spring onions. Squeeze over lime wedges to serve.""}]","[{""meth_group"":""STEP 1""},{""meth_group"":""For the salmon, combine all the ingredients, except the avocado and seaweed, in a bowl and mix well. Cover and leave to marinate in the fridge while you prepare the other ingredients.""},{""meth_group"":""STEP 2""},{""meth_group"":""For the prawns, heat the olive oil in a pan over a high heat. Add the garlic, ginger, spring onions and chilli, stirring into the oil for 20 secs. Add the prawns and stir constantly until cooked through and pink. Remove from the heat and stir through the lime zest and juice.""},{""meth_group"":""STEP 3""},{""meth_group"":""Stir the avocado into the salmon and warm the taco shells following pack instructions. Fill each taco with the prawns or the salmon. Top the salmon tacos with the seaweed and the prawn tacos with coriander and extra spring onions. Squeeze over lime wedges to serve.""}]","[{""ing_group"":""8 crispy corn taco shells""},{""ing_group"":""2 sushi-grade skinless salmon fillets (about 250g), cut into 1cm cubes (ask your fishmonger)""},{""ing_group"":""2 tbsp soy sauce""},{""ing_group"":""2 tbsp Yuzu juice or lime juice""},{""ing_group"":""1 tsp sesame oil""},{""ing_group"":""1 avocado , stoned, peeled and cubed""},{""ing_group"":""nori seaweed , sliced, to serve""},{""ing_group"":""1 tsp olive oil""},{""ing_group"":""1 crushed garlic""},{""ing_group"":""1 tsp crushed ginger""},{""ing_group"":""3 spring onions , sliced, plus extra to serve""},{""ing_group"":""1⁄2 tsp finely chopped red chilli""},{""ing_group"":""250g raw king prawns , roughly chopped""},{""ing_group"":""1 lime , zested and juiced, plus wedges to serve""},{""ing_group"":""1⁄2 small bunch coriander , leaves picked""}]"
"1614336400-5044","https://www.bbcgoodfood.com/recipes/collection/easy-summer-recipes","Page 4","https://www.bbcgoodfood.com/recipes/collection/easy-summer-recipes/4","Pea mousse","https://www.bbcgoodfood.com/recipes/pea-mousse","","","[{""meth_list"":""STEP 1""},{""meth_list"":""Put the cream and milk in a pan and heat slowly until almost boiling. Soak the gelatine in cold water until floppy.""},{""meth_list"":""STEP 2""},{""meth_list"":""Put the egg yolks in a bowl with the sugar and whisk together with the salt. Pour the milk mixture over the yolks, then pour the lot back into the pan (give it a wipe first to clean the bottom) and stir the mixture over a low heat until it starts to thicken and make a thin custard. Keep stirring and don’t turn the heat up too high or the eggs might start to cook into clumps.""},{""meth_list"":""STEP 3""},{""meth_list"":""Turn off the heat and stir in the gelatine, chocolate and butter then, once incorporated, stir in the peas. Whizz in a blender until it is as fine as you can get it, then pour it through a sieve into a jug. Either chill in a box or divide the mixture between glasses and chill them. If you’ve chilled the mixture in a box, spoon or pipe it into glasses to serve and decorate with pea shoots and flowers.""}]","[{""meth_group"":""STEP 1""},{""meth_group"":""Put the cream and milk in a pan and heat slowly until almost boiling. Soak the gelatine in cold water until floppy.""},{""meth_group"":""STEP 2""},{""meth_group"":""Put the egg yolks in a bowl with the sugar and whisk together with the salt. Pour the milk mixture over the yolks, then pour the lot back into the pan (give it a wipe first to clean the bottom) and stir the mixture over a low heat until it starts to thicken and make a thin custard. Keep stirring and don’t turn the heat up too high or the eggs might start to cook into clumps.""},{""meth_group"":""STEP 3""},{""meth_group"":""Turn off the heat and stir in the gelatine, chocolate and butter then, once incorporated, stir in the peas. Whizz in a blender until it is as fine as you can get it, then pour it through a sieve into a jug. Either chill in a box or divide the mixture between glasses and chill them. If you’ve chilled the mixture in a box, spoon or pipe it into glasses to serve and decorate with pea shoots and flowers.""}]","[{""ing_group"":""120ml double cream""},{""ing_group"":""120ml milk""},{""ing_group"":""3 ⅓ sheets gelatine (the sheets are easy to snap into thirds)""},{""ing_group"":""5 egg yolks (freeze the whites for meringues)""},{""ing_group"":""15g golden caster sugar""},{""ing_group"":""pinch salt""},{""ing_group"":""200g white chocolate , chopped""},{""ing_group"":""60g butter , chopped""},{""ing_group"":""200g frozen petits pois , defrosted""},{""ing_group"":""pea shoots and edible flowers, to decorate""}]"
"1614336300-4978","https://www.bbcgoodfood.com/recipes/collection/easy-summer-recipes","","","Sweetcorn fritters with eggs & black bean salsa","https://www.bbcgoodfood.com/recipes/sweetcorn-fritters-eggs-black-bean-salsa","Sweetcorn fritters with eggs & black bean salsa","","","[{""meth_group"":""STEP 1""},{""meth_group"":""Heat the oven to 200C/180C fan/gas 6 and line a large baking tray with baking parchment.""},{""meth_group"":""STEP 2""},{""meth_group"":""Heat the oil in a small pan and fry the onion and pepper for 5 mins until softened. Meanwhile, mix the flour, spices and baking powder in a bowl. Add the onions, pepper, corn and 2 of the eggs, then mix together well.""},{""meth_group"":""STEP 3""},{""meth_group"":""Spoon eight mounds of the mixture onto the baking tray, well spaced apart, then flatten slightly with the back of the spoon. Bake for 20 mins until set and golden.""},{""meth_group"":""STEP 4""},{""meth_group"":""Meanwhile, mix together the salsa ingredients and poach 2 of the remaining eggs to your liking. If you're following our Healthy Diet Plan, serve four fritters on the day you make them, topped with half the salsa and the poached eggs. Chill the remaining fritters for another day. Reheat them in a pan or microwave and serve with 2 more poached eggs and the remaining salsa.""}]","[{""ing_group"":""1 tsp rapeseed oil""},{""ing_group"":""1 small red onion (85g), finely chopped""},{""ing_group"":""1 red pepper , deseeded and finely diced""},{""ing_group"":""100g wholemeal self-raising flour""},{""ing_group"":""1 tsp smoked paprika""},{""ing_group"":""1 tsp ground coriander""},{""ing_group"":""1 tsp baking powder""},{""ing_group"":""325g can sweetcorn , drained""},{""ing_group"":""6 large eggs""},{""ing_group"":""1 small red onion (85g), finely chopped""},{""ing_group"":""4 tomatoes (320g), chopped""},{""ing_group"":""2 x 400g cans black beans , drained""},{""ing_group"":""1 lime , zested and juiced""},{""ing_group"":""½ x 30g pack coriander , chopped""}]"
"1614336291-4972","https://www.bbcgoodfood.com/recipes/collection/easy-summer-recipes","","","Stuffed rainbow baguette","https://www.bbcgoodfood.com/recipes/stuffed-rainbow-baguette","Stuffed rainbow baguette","","","[{""meth_group"":""STEP 1""},{""meth_group"":""Cut the baguette in half so you can open it out like a book. Spread the hummus over the bottom half of the baguette and add the cheese, breaking the slices up if you need to. Scatter the pepper, beetroot, radish and carrot along the baguette, then add the leaves, dribble with the pesto and close the baguette.""},{""meth_group"":""STEP 2""},{""meth_group"":""Wrap the baguette tightly in baking parchment and tie securely with string. Take a bread knife with you so you can slice it when you’re ready to eat it.""}]","[{""ing_group"":""1 artisan-style baguette""},{""ing_group"":""4 tbsp hummus""},{""ing_group"":""8 slices medium  cheddar""},{""ing_group"":""¼ red pepper , thinly sliced""},{""ing_group"":""¼ cooked beetroot , shredded""},{""ing_group"":""2 radishes , thinly sliced""},{""ing_group"":""1 yellow or orange carrot , shredded or grated""},{""ing_group"":""handful green leaves""},{""ing_group"":""1 tbsp vegetarian pesto , mixed with 1 tbsp olive oil""}]"
"1614336247-4946","https://www.bbcgoodfood.com/recipes/collection/easy-summer-recipes","","","Slow-roasted courgettes with fennel & orzo","https://www.bbcgoodfood.com/recipes/slow-roasted-courgettes-fennel-orzo","","[{""ingr_list"":""pinch of saffron""},{""ingr_list"":""1⁄2 bulb of fennel , sliced""},{""ingr_list"":""100g cherry tomatoes , halved""},{""ingr_list"":""1 bay leaf""},{""ingr_list"":""2 tbsp olive oil""},{""ingr_list"":""pinch of dried chilli flakes""},{""ingr_list"":""120ml dry white wine""},{""ingr_list"":""4-6 baby to medium-sized courgettes""},{""ingr_list"":""1 lemon , zested""},{""ingr_list"":""50g sourdough breadcrumbs""},{""ingr_list"":""200g orzo""},{""ingr_list"":""1 tbsp pine nuts , toasted""},{""ingr_list"":""1 tbsp ricotta""},{""ingr_list"":""handful of dill""}]","","[{""meth_group"":""STEP 1""},{""meth_group"":""Put the saffron in a small bowl and cover with 1/2 tbsp of boiling water. Heat oven to 180C/160C fan/gas 4. Put the fennel in a roasting tin with the tomatoes and bay leaf, drizzle over some oil, season and toss together with the chilli flakes. Pour over the wine. Prick the courgettes all over with a fork and place on top of the fennel. Drizzle with a little more oil, then season and cover with foil.""},{""meth_group"":""STEP 2""},{""meth_group"":""Roast for 1 1/2 - 2 hrs, turning the courgettes halfway through, removing the foil for the last 5 mins. The courgettes should be very soft. Lift the courgettes from the pan and set aside.""},{""meth_group"":""STEP 3""},{""meth_group"":""Meanwhile, heat 1 tbsp olive oil in a frying pan over a medium heat. Add half the lemon zest and breadcrumbs, and gently fry until the bread is golden and crunchy. Set aside.""},{""meth_group"":""STEP 4""},{""meth_group"":""Cook the orzo in a pan of boiling water until al dente, then drain. Toss with the fennel, tomatoes, pine nuts, the saffron and its water. Season.""},{""meth_group"":""STEP 5""},{""meth_group"":""Divide the orzo between plates and add half the ricotta to each, drizzle with olive oil and sprinkle with sea salt. Top with the courgettes and scatter over the breadcrumbs, remaining lemon zest and sprigs of dill.""}]","[{""ing_group"":""pinch of saffron""},{""ing_group"":""1⁄2 bulb of fennel , sliced""},{""ing_group"":""100g cherry tomatoes , halved""},{""ing_group"":""1 bay leaf""},{""ing_group"":""2 tbsp olive oil""},{""ing_group"":""pinch of dried chilli flakes""},{""ing_group"":""120ml dry white wine""},{""ing_group"":""4-6 baby to medium-sized courgettes""},{""ing_group"":""1 lemon , zested""},{""ing_group"":""50g sourdough breadcrumbs""},{""ing_group"":""200g orzo""},{""ing_group"":""1 tbsp pine nuts , toasted""},{""ing_group"":""1 tbsp ricotta""},{""ing_group"":""handful of dill""}]"
"1614336587-5122","https://www.bbcgoodfood.com/recipes/collection/easy-summer-recipes","Page 2","https://www.bbcgoodfood.com/recipes/collection/easy-summer-recipes/2","Chipotle gazpacho","https://www.bbcgoodfood.com/recipes/chipotle-gazpacho","","[{""ingr_list"":""1kg ripe tomatoes , roughly chopped""},{""ingr_list"":""1 large red pepper , deseeded and roughly chopped""},{""ingr_list"":""½ cucumber , sliced""},{""ingr_list"":""4 spring onions , finely sliced""},{""ingr_list"":""1 small garlic clove , grated""},{""ingr_list"":""40g blanched almonds , roughly chopped""},{""ingr_list"":""3 limes , juiced""},{""ingr_list"":""2 tbsp olive oil""},{""ingr_list"":""2 tsp chipotle paste""},{""ingr_list"":""1 large, ripe avocado , cubed""},{""ingr_list"":""1 small red chilli , deseeded and finely chopped""},{""ingr_list"":""½ small bunch coriander , finely chopped""}]","","[{""meth_group"":""STEP 1""},{""meth_group"":""Put the tomatoes, pepper, cucumber, two of the spring onions, the garlic, half the almonds, half the lime juice, and all the olive oil and chipotle paste into a blender. Whizz until almost smooth. Pour into a jug and chill for at least 2 hrs.""},{""meth_group"":""STEP 2""},{""meth_group"":""When ready to eat, toss the remaining spring onion, avocado, chilli and coriander with the remaining lime juice. Ladle the soup into four bowls and top with the avocado salsa and reserved almonds.""}]","[{""ing_group"":""1kg ripe tomatoes , roughly chopped""},{""ing_group"":""1 large red pepper , deseeded and roughly chopped""},{""ing_group"":""½ cucumber , sliced""},{""ing_group"":""4 spring onions , finely sliced""},{""ing_group"":""1 small garlic clove , grated""},{""ing_group"":""40g blanched almonds , roughly chopped""},{""ing_group"":""3 limes , juiced""},{""ing_group"":""2 tbsp olive oil""},{""ing_group"":""2 tsp chipotle paste""},{""ing_group"":""1 large, ripe avocado , cubed""},{""ing_group"":""1 small red chilli , deseeded and finely chopped""},{""ing_group"":""½ small bunch coriander , finely chopped""}]"
"1614336286-4971","https://www.bbcgoodfood.com/recipes/collection/easy-summer-recipes","","","Smashed cannellini bean tartine","https://www.bbcgoodfood.com/recipes/smashed-cannellini-bean-tartine","","","[{""meth_list"":""STEP 1""},{""meth_list"":""Put the beans, 1 tbsp of the oil, the lemon zest and juice and the garlic in a food processor and blitz to create a chunky texture. Transfer to a bowl and stir through the chilli, parsley and cherry tomatoes.""},{""meth_list"":""STEP 2""},{""meth_list"":""Lightly toast the bread and pile on the cannellini bean smash, scatter over the feta and drizzle with the remaining oil. Serve with the rocket on the side.""}]","[{""meth_group"":""STEP 1""},{""meth_group"":""Put the beans, 1 tbsp of the oil, the lemon zest and juice and the garlic in a food processor and blitz to create a chunky texture. Transfer to a bowl and stir through the chilli, parsley and cherry tomatoes.""},{""meth_group"":""STEP 2""},{""meth_group"":""Lightly toast the bread and pile on the cannellini bean smash, scatter over the feta and drizzle with the remaining oil. Serve with the rocket on the side.""}]","[{""ing_group"":""400g can cannellini beans , drained and rinsed""},{""ing_group"":""2 tbsp rapeseed oil""},{""ing_group"":""1 large lemon , zested and juiced""},{""ing_group"":""1 small garlic clove , finely grated""},{""ing_group"":""1 small red chilli , deseeded and finely chopped""},{""ing_group"":""1⁄2 small bunch parsley , finely chopped""},{""ing_group"":""8 cherry tomatoes , halved""},{""ing_group"":""2 slices sourdough""},{""ing_group"":""15g feta , crumbled""},{""ing_group"":""50g rocket""}]"
"1614336415-5052","https://www.bbcgoodfood.com/recipes/collection/easy-summer-recipes","Page 4","https://www.bbcgoodfood.com/recipes/collection/easy-summer-recipes/4","Crab & avocado tostadas","https://www.bbcgoodfood.com/recipes/crab-avocado-tostadas","","[{""ingr_list"":""1 small  red onion , sliced into thin rings""},{""ingr_list"":""juice 2  limes , plus wedges to serve""},{""ingr_list"":""pinch of  caster sugar""},{""ingr_list"":""170g can white crabmeat in brine, drained""},{""ingr_list"":""2 spring onions , finely sliced""},{""ingr_list"":""1 red chilli , deseeded and chopped""},{""ingr_list"":""1 really ripe avocado , peeled, stoned and chopped""},{""ingr_list"":""1 small garlic clove , crushed""},{""ingr_list"":""2 corn tortillas""},{""ingr_list"":""handful mixed salad leaves""}]","","[{""meth_group"":""STEP 1""},{""meth_group"":""Put the onion in a bowl and cover with half the lime juice and a good pinch each of sugar and salt. Leave to soften while you get everything else ready.""},{""meth_group"":""STEP 2""},{""meth_group"":""Mix together the crabmeat, spring onions and half the chilli. Season with black pepper and set aside. Mash the avocado with the remaining lime juice, garlic and some seasoning. You can leave it quite chunky or mash it until smooth. Stir in the rest of the chilli.""},{""meth_group"":""STEP 3""},{""meth_group"":""Bend each tortilla in half and toast in a toaster for 1 min. Put on 2 plates and top with the salad leaves, then mashed avocado. Finish with the crabmeat and drained pickled onion. Serve with lime wedges for squeezing over.""}]","[{""ing_group"":""1 small  red onion , sliced into thin rings""},{""ing_group"":""juice 2  limes , plus wedges to serve""},{""ing_group"":""pinch of  caster sugar""},{""ing_group"":""170g can white crabmeat in brine, drained""},{""ing_group"":""2 spring onions , finely sliced""},{""ing_group"":""1 red chilli , deseeded and chopped""},{""ing_group"":""1 really ripe avocado , peeled, stoned and chopped""},{""ing_group"":""1 small garlic clove , crushed""},{""ing_group"":""2 corn tortillas""},{""ing_group"":""handful mixed salad leaves""}]"
"1614336286-4970","https://www.bbcgoodfood.com/recipes/collection/easy-summer-recipes","","","Smashed cannellini bean tartine","https://www.bbcgoodfood.com/recipes/smashed-cannellini-bean-tartine","","[{""ingr_list"":""400g can cannellini beans , drained and rinsed""},{""ingr_list"":""2 tbsp rapeseed oil""},{""ingr_list"":""1 large lemon , zested and juiced""},{""ingr_list"":""1 small garlic clove , finely grated""},{""ingr_list"":""1 small red chilli , deseeded and finely chopped""},{""ingr_list"":""1⁄2 small bunch parsley , finely chopped""},{""ingr_list"":""8 cherry tomatoes , halved""},{""ingr_list"":""2 slices sourdough""},{""ingr_list"":""15g feta , crumbled""},{""ingr_list"":""50g rocket""}]","","[{""meth_group"":""STEP 1""},{""meth_group"":""Put the beans, 1 tbsp of the oil, the lemon zest and juice and the garlic in a food processor and blitz to create a chunky texture. Transfer to a bowl and stir through the chilli, parsley and cherry tomatoes.""},{""meth_group"":""STEP 2""},{""meth_group"":""Lightly toast the bread and pile on the cannellini bean smash, scatter over the feta and drizzle with the remaining oil. Serve with the rocket on the side.""}]","[{""ing_group"":""400g can cannellini beans , drained and rinsed""},{""ing_group"":""2 tbsp rapeseed oil""},{""ing_group"":""1 large lemon , zested and juiced""},{""ing_group"":""1 small garlic clove , finely grated""},{""ing_group"":""1 small red chilli , deseeded and finely chopped""},{""ing_group"":""1⁄2 small bunch parsley , finely chopped""},{""ing_group"":""8 cherry tomatoes , halved""},{""ing_group"":""2 slices sourdough""},{""ing_group"":""15g feta , crumbled""},{""ing_group"":""50g rocket""}]"
"1614336295-4976","https://www.bbcgoodfood.com/recipes/collection/easy-summer-recipes","","","Roasted vegetables","https://www.bbcgoodfood.com/recipes/roasted-vegetables","","[{""ingr_list"":""3 tbsp olive oil""},{""ingr_list"":""1 aubergine, cut into chunks""},{""ingr_list"":""2 mixed coloured peppers, such as orange and red, cut into chunks""},{""ingr_list"":""1 red onion, cut into wedges""},{""ingr_list"":""2 courgettes, cut into chunks""},{""ingr_list"":""4 garlic cloves, smashed""},{""ingr_list"":""3 sprigs of thyme""},{""ingr_list"":""200g cherry tomatoes""},{""ingr_list"":""handful of basil leaves""},{""ingr_list"":""zest of 1 lemon""},{""ingr_list"":""50g feta, crumbled""}]","","[{""meth_group"":""STEP 1""},{""meth_group"":""Heat the oven to 200C/180C Fan/gas 6. Mix the oil with the aubergine, peppers, red onion, courgette, garlic and thyme in a bowl with sea salt and black pepper. Tip into a large roasting tin then roast for 30 mins. Add the tomatoes to the pan and return to the oven for 10 mins.""},{""meth_group"":""STEP 2""},{""meth_group"":""Squeeze the garlic from their skins, remove the thyme then scatter over the basil, lemon zest and crumbled feta.""}]","[{""ing_group"":""3 tbsp olive oil""},{""ing_group"":""1 aubergine, cut into chunks""},{""ing_group"":""2 mixed coloured peppers, such as orange and red, cut into chunks""},{""ing_group"":""1 red onion, cut into wedges""},{""ing_group"":""2 courgettes, cut into chunks""},{""ing_group"":""4 garlic cloves, smashed""},{""ing_group"":""3 sprigs of thyme""},{""ing_group"":""200g cherry tomatoes""},{""ing_group"":""handful of basil leaves""},{""ing_group"":""zest of 1 lemon""},{""ing_group"":""50g feta, crumbled""}]"
"1614336410-5049","https://www.bbcgoodfood.com/recipes/collection/easy-summer-recipes","Page 4","https://www.bbcgoodfood.com/recipes/collection/easy-summer-recipes/4","Grilled steak salad with horseradish dressing","https://www.bbcgoodfood.com/recipes/grilled-steak-salad-horseradish-dressing","","[{""ingr_list"":""250g/9oz bavette or skirt steak""},{""ingr_list"":""1 tsp celery seeds, crushed""},{""ingr_list"":""1 tbsp Worcestershire sauce""},{""ingr_list"":""little olive oil , for brushing""},{""ingr_list"":""6 celery sticks, thinly sliced, leaves reserved""},{""ingr_list"":""200g mixed tomato , sliced or halved (beefsteak, plum and red and yellow cherry are all good)""},{""ingr_list"":""1 tbsp Worcestershire sauce""},{""ingr_list"":""1 tbsp olive oil""},{""ingr_list"":""1 tsp horseradish sauce""},{""ingr_list"":""1 tsp red wine vinegar""},{""ingr_list"":""1 tsp tomato purée""}]","","[{""meth_group"":""STEP 1""},{""meth_group"":""Rub the steak on both sides with the crushed celery seeds, some seasoning and the Worcestershire sauce. Brush with olive oil and leave to marinate while you prepare the salad.""},{""meth_group"":""STEP 2""},{""meth_group"":""Mix the dressing ingredients in a small bowl. Divide the celery and tomatoes between 2 plates. Heat a griddle pan over a high heat, then cook the meat for 2-3 mins on each side (depending on how thick your steaks are). Remove from the heat and leave to rest, covered with foil, for 5 mins.""},{""meth_group"":""STEP 3""},{""meth_group"":""Slice the steaks and place on top of the salads, pour the dressing over and scatter over the celery leaves.""}]","[{""ing_group"":""250g/9oz bavette or skirt steak""},{""ing_group"":""1 tsp celery seeds, crushed""},{""ing_group"":""1 tbsp Worcestershire sauce""},{""ing_group"":""little olive oil , for brushing""},{""ing_group"":""6 celery sticks, thinly sliced, leaves reserved""},{""ing_group"":""200g mixed tomato , sliced or halved (beefsteak, plum and red and yellow cherry are all good)""},{""ing_group"":""1 tbsp Worcestershire sauce""},{""ing_group"":""1 tbsp olive oil""},{""ing_group"":""1 tsp horseradish sauce""},{""ing_group"":""1 tsp red wine vinegar""},{""ing_group"":""1 tsp tomato purée""}]"
"1614336423-5058","https://www.bbcgoodfood.com/recipes/collection/easy-summer-recipes","Page 4","https://www.bbcgoodfood.com/recipes/collection/easy-summer-recipes/4","Bean, feta & herb dip","https://www.bbcgoodfood.com/recipes/bean-feta-herb-dip","","[{""ingr_list"":""400g can cannellini bean""},{""ingr_list"":""200g feta cheese""},{""ingr_list"":""1 tbsp lemon juice""},{""ingr_list"":""1 garlic clove , crushed""},{""ingr_list"":""3 tbsp chopped dill, mint or  chives (or 1 tbsp each)""}]","","[{""meth_group"":""STEP 1""},{""meth_group"":""Drain and rinse beans. Tip into a food processor with feta, lemon juice and garlic, and whizz until smooth. Add dill, mint or chives, and season with pepper.""}]","[{""ing_group"":""400g can cannellini bean""},{""ing_group"":""200g feta cheese""},{""ing_group"":""1 tbsp lemon juice""},{""ing_group"":""1 garlic clove , crushed""},{""ing_group"":""3 tbsp chopped dill, mint or  chives (or 1 tbsp each)""}]"
