web-scraper-order,web-scraper-start-url,pagination,pagination-href,recip,recip-href,name,ingr_list,meth_list,meth_group,ing_group
"1614336415-5051","https://www.bbcgoodfood.com/recipes/collection/easy-summer-recipes","Page 4","https://www.bbcgoodfood.com/recipes/collection/easy-summer-recipes/4","Crab & avocado tostadas","https://www.bbcgoodfood.com/recipes/crab-avocado-tostadas","Crab & avocado tostadas","","","[{""meth_group"":""STEP 1""},{""meth_group"":""Put the onion in a bowl and cover with half the lime juice and a good pinch each of sugar and salt. Leave to soften while you get everything else ready.""},{""meth_group"":""STEP 2""},{""meth_group"":""Mix together the crabmeat, spring onions and half the chilli. Season with black pepper and set aside. Mash the avocado with the remaining lime juice, garlic and some seasoning. You can leave it quite chunky or mash it until smooth. Stir in the rest of the chilli.""},{""meth_group"":""STEP 3""},{""meth_group"":""Bend each tortilla in half and toast in a toaster for 1 min. Put on 2 plates and top with the salad leaves, then mashed avocado. Finish with the crabmeat and drained pickled onion. Serve with lime wedges for squeezing over.""}]","[{""ing_group"":""1 small  red onion , sliced into thin rings""},{""ing_group"":""juice 2  limes , plus wedges to serve""},{""ing_group"":""pinch of  caster sugar""},{""ing_group"":""170g can white crabmeat in brine, drained""},{""ing_group"":""2 spring onions , finely sliced""},{""ing_group"":""1 red chilli , deseeded and chopped""},{""ing_group"":""1 really ripe avocado , peeled, stoned and chopped""},{""ing_group"":""1 small garlic clove , crushed""},{""ing_group"":""2 corn tortillas""},{""ing_group"":""handful mixed salad leaves""}]"
"1614336271-4961","https://www.bbcgoodfood.com/recipes/collection/easy-summer-recipes","","","Tomato, burrata & broad bean salad","https://www.bbcgoodfood.com/recipes/tomato-burrata-broad-bean-salad","","[{""ingr_list"":""500g tomatoes (I used a mix of sizes and colours)""},{""ingr_list"":""1⁄2 tsp caster sugar""},{""ingr_list"":""150g broad beans , podded""},{""ingr_list"":""handful basil""},{""ingr_list"":""handful chives""},{""ingr_list"":""handful flat leaf parsley""},{""ingr_list"":""1 tbsp tarragon""},{""ingr_list"":""1 tbsp lovage""},{""ingr_list"":""1 tbsp mint leaves""},{""ingr_list"":""3 tbsp olive oil""},{""ingr_list"":""2 tsp Dijon mustard""},{""ingr_list"":""pinch of fennel seeds""},{""ingr_list"":""1 lemon , zested""},{""ingr_list"":""1 tbsp red wine vinegar""},{""ingr_list"":""2 x 100g burrata or 2 x 125g balls mozzarella""},{""ingr_list"":""50g hazelnuts , toasted and roughly chopped""}]","","[{""meth_group"":""STEP 1""},{""meth_group"":""Chop the tomatoes into a mixture of slices and wedges, then put them in a bowl. Toss with 1/2 tsp salt and the sugar, then leave to marinate for 30 mins. Meanwhile, bring a pan of water to the boil and add the broad beans. Boil for 2 mins, then drain and allow to cool for a couple of mins. Peel them out of their shells. This is a bit fiddly but well worth it – I use my thumbnail to pierce the skin, then gently squeeze out the shiny green beans.""},{""meth_group"":""STEP 2""},{""meth_group"":""Finely chop the herbs, then tip into a bowl and whisk in the olive oil, mustard, fennel seeds, most of the lemon zest, and red wine vinegar. Season, then stir in the broad beans.""},{""meth_group"":""STEP 3""},{""meth_group"":""Tip the tomatoes onto a serving platter. Top with the burrata, then spoon over the broad bean salsa. Scatter over the hazelnuts and remaining lemon zest to serve.""}]","[{""ing_group"":""500g tomatoes (I used a mix of sizes and colours)""},{""ing_group"":""1⁄2 tsp caster sugar""},{""ing_group"":""150g broad beans , podded""},{""ing_group"":""handful basil""},{""ing_group"":""handful chives""},{""ing_group"":""handful flat leaf parsley""},{""ing_group"":""1 tbsp tarragon""},{""ing_group"":""1 tbsp lovage""},{""ing_group"":""1 tbsp mint leaves""},{""ing_group"":""3 tbsp olive oil""},{""ing_group"":""2 tsp Dijon mustard""},{""ing_group"":""pinch of fennel seeds""},{""ing_group"":""1 lemon , zested""},{""ing_group"":""1 tbsp red wine vinegar""},{""ing_group"":""2 x 100g burrata or 2 x 125g balls mozzarella""},{""ing_group"":""50g hazelnuts , toasted and roughly chopped""}]"
"1614336513-5074","https://www.bbcgoodfood.com/recipes/collection/easy-summer-recipes","Page 2","https://www.bbcgoodfood.com/recipes/collection/easy-summer-recipes/2","Swedish meatballs with beetroot & apple salad","https://www.bbcgoodfood.com/recipes/swedish-meatballs-beetroot-apple-salad","","[{""ingr_list"":""500g lean pork mince (5% fat)""},{""ingr_list"":""100g coarsely grated courgette , squeezed of excess juice""},{""ingr_list"":""1 onion , grated""},{""ingr_list"":""4 tbsp chopped fresh dill""},{""ingr_list"":""2 garlic cloves , finely grated""},{""ingr_list"":""1 egg""},{""ingr_list"":""1 tbsp rapeseed oil""},{""ingr_list"":""1 tsp thyme leaves""},{""ingr_list"":""2 tsp vegetable bouillon powder , made up to 300ml with boiling water""},{""ingr_list"":""2 tbsp half-fat crème fraîche""},{""ingr_list"":""1 large apple , chopped""},{""ingr_list"":""1 red onion , halved and thinly sliced""},{""ingr_list"":""4 tbsp chopped parsley""},{""ingr_list"":""2 tsp capers""},{""ingr_list"":""½ lemon , juiced""},{""ingr_list"":""320g cooked beetroot , cut into strips""}]","","[{""meth_group"":""STEP 1""},{""meth_group"":""To make the meatballs, tip the pork into a bowl and add the grated courgette and onion, half the dill, half the garlic and plenty of black pepper. Break in the egg and mix well with your hands. When everything is well combined, break off walnut-size pieces and roll into balls – you should end up with about 28. The mixture will be very soft.""},{""meth_group"":""STEP 2""},{""meth_group"":""Heat the oil in a large non-stick frying pan then gently fry the meatballs in two batches until firm and pale golden, turning them every now and then so they brown evenly. Each batch should take 6-8 mins.""},{""meth_group"":""STEP 3""},{""meth_group"":""Wipe out the pan to remove excess fat and add the remaining garlic and thyme, then pour in the bouillon and bring to the boil. Turn off the heat, stir in the crème fraîche and remaining dill, then return the meatballs to the pan and turn them in the mixture until coated.""},{""meth_group"":""STEP 4""},{""meth_group"":""For the salad, mix the apple, onion, parsley and capers with the lemon, then stir through the beetroot. Serve the salad alongside the meatballs. If you’re cooking for two people, eat half the meatballs and salad now, and chill the rest for another day – it will keep in the fridge for up to three days. Reheat the meatballs in the microwave until piping hot.""}]","[{""ing_group"":""500g lean pork mince (5% fat)""},{""ing_group"":""100g coarsely grated courgette , squeezed of excess juice""},{""ing_group"":""1 onion , grated""},{""ing_group"":""4 tbsp chopped fresh dill""},{""ing_group"":""2 garlic cloves , finely grated""},{""ing_group"":""1 egg""},{""ing_group"":""1 tbsp rapeseed oil""},{""ing_group"":""1 tsp thyme leaves""},{""ing_group"":""2 tsp vegetable bouillon powder , made up to 300ml with boiling water""},{""ing_group"":""2 tbsp half-fat crème fraîche""},{""ing_group"":""1 large apple , chopped""},{""ing_group"":""1 red onion , halved and thinly sliced""},{""ing_group"":""4 tbsp chopped parsley""},{""ing_group"":""2 tsp capers""},{""ing_group"":""½ lemon , juiced""},{""ing_group"":""320g cooked beetroot , cut into strips""}]"
"1614336359-5015","https://www.bbcgoodfood.com/recipes/collection/easy-summer-recipes","Page 4","https://www.bbcgoodfood.com/recipes/collection/easy-summer-recipes/4","Salted tomato salad","https://www.bbcgoodfood.com/recipes/salted-tomato-salad","Salted tomato salad","","","[{""meth_group"":""STEP 1""},{""meth_group"":""Chop the tomatoes into equal-sized chunks and slice the onion, then transfer them to a bowl. Grate the garlic, then add to the tomatoes, along with the basil leaves.""},{""meth_group"":""STEP 2""},{""meth_group"":""Sprinkle with ½ tsp salt, pour over the oil and toss together. Leave to infuse for up to 30 mins, then serve sprinkled with nigella seeds.""}]","[{""ing_group"":""300g heritage tomatoes , various shapes and sizes""},{""ing_group"":""1 red onion""},{""ing_group"":""1 garlic clove""},{""ing_group"":""8 small basil leaves""},{""ing_group"":""1 tbsp olive oil""},{""ing_group"":""1 tbsp nigella seeds""}]"
"1614336295-4977","https://www.bbcgoodfood.com/recipes/collection/easy-summer-recipes","","","Roasted vegetables","https://www.bbcgoodfood.com/recipes/roasted-vegetables","","","[{""meth_list"":""STEP 1""},{""meth_list"":""Heat the oven to 200C/180C Fan/gas 6. Mix the oil with the aubergine, peppers, red onion, courgette, garlic and thyme in a bowl with sea salt and black pepper. Tip into a large roasting tin then roast for 30 mins. Add the tomatoes to the pan and return to the oven for 10 mins.""},{""meth_list"":""STEP 2""},{""meth_list"":""Squeeze the garlic from their skins, remove the thyme then scatter over the basil, lemon zest and crumbled feta.""}]","[{""meth_group"":""STEP 1""},{""meth_group"":""Heat the oven to 200C/180C Fan/gas 6. Mix the oil with the aubergine, peppers, red onion, courgette, garlic and thyme in a bowl with sea salt and black pepper. Tip into a large roasting tin then roast for 30 mins. Add the tomatoes to the pan and return to the oven for 10 mins.""},{""meth_group"":""STEP 2""},{""meth_group"":""Squeeze the garlic from their skins, remove the thyme then scatter over the basil, lemon zest and crumbled feta.""}]","[{""ing_group"":""3 tbsp olive oil""},{""ing_group"":""1 aubergine, cut into chunks""},{""ing_group"":""2 mixed coloured peppers, such as orange and red, cut into chunks""},{""ing_group"":""1 red onion, cut into wedges""},{""ing_group"":""2 courgettes, cut into chunks""},{""ing_group"":""4 garlic cloves, smashed""},{""ing_group"":""3 sprigs of thyme""},{""ing_group"":""200g cherry tomatoes""},{""ing_group"":""handful of basil leaves""},{""ing_group"":""zest of 1 lemon""},{""ing_group"":""50g feta, crumbled""}]"
"1614336569-5110","https://www.bbcgoodfood.com/recipes/collection/easy-summer-recipes","Page 2","https://www.bbcgoodfood.com/recipes/collection/easy-summer-recipes/2","Strawberry shortbread ice cream sandwich","https://www.bbcgoodfood.com/recipes/strawberry-shortbread-ice-cream-sandwich","","[{""ingr_list"":""4 scoops strawberry cheesecake ice cream , softened""},{""ingr_list"":""a few fresh strawberries , finely chopped""},{""ingr_list"":""8 Viennese whirls (or shortbread biscuits)""}]","","[{""meth_group"":""STEP 1""},{""meth_group"":""Mix the ice cream with the strawberries and freeze until solid.""},{""meth_group"":""STEP 2""},{""meth_group"":""Sandwich spoonfuls of the ice cream between the biscuits, then eat immediately.""}]","[{""ing_group"":""4 scoops strawberry cheesecake ice cream , softened""},{""ing_group"":""a few fresh strawberries , finely chopped""},{""ing_group"":""8 Viennese whirls (or shortbread biscuits)""}]"
"1614336335-5001","https://www.bbcgoodfood.com/recipes/collection/easy-summer-recipes","Page 4","https://www.bbcgoodfood.com/recipes/collection/easy-summer-recipes/4","Cheesy seafood bake","https://www.bbcgoodfood.com/recipes/cheesy-seafood-bake","","[{""ingr_list"":""300g medium potatoes (about 3), thinly sliced""},{""ingr_list"":""2 tbsp milk""},{""ingr_list"":""40g mature cheddar , finely grated""},{""ingr_list"":""1 tsp rapeseed oil""},{""ingr_list"":""1 onion (160g), finely chopped""},{""ingr_list"":""1 red pepper , deseeded and finely diced (270g)""},{""ingr_list"":""2 tsp balsamic vinegar""},{""ingr_list"":""1 tsp vegetable bouillon powder""},{""ingr_list"":""400g can chopped tomatoes""},{""ingr_list"":""½ x 30g pack basil , leaves picked and finely chopped""},{""ingr_list"":""1 garlic clove , finely grated""},{""ingr_list"":""280g pack skinless cod loins""},{""ingr_list"":""100g frozen small Atlantic cooked prawns , defrosted""},{""ingr_list"":""160g broccoli florets""}]","","[{""meth_group"":""STEP 1""},{""meth_group"":""Boil the potato slices for 10 mins then drain, tip into a bowl and gently mix in the milk and half the cheese. Don’t worry if the potatoes break up a little.""},{""meth_group"":""STEP 2""},{""meth_group"":""Meanwhile, heat the oil in a large frying pan and cook the onion until softened. Stir in the pepper and cook for 5 mins more. Spoon in the balsamic vinegar and bouillon powder, then stir in the tomatoes, basil and garlic. Lay the cod fillets on top, then cover and cook for 6-8 mins until the cod flakes when tested. Heat the grill to high.""},{""meth_group"":""STEP 3""},{""meth_group"":""Take off the heat, stir in the prawns and tip into a shallow baking dish, breaking up the cod into large chunks. Cover with the potatoes and sprinkle with the remaining cheese. Grill until golden. While it’s grilling, steam or boil the broccoli to serve with the bake.""}]","[{""ing_group"":""300g medium potatoes (about 3), thinly sliced""},{""ing_group"":""2 tbsp milk""},{""ing_group"":""40g mature cheddar , finely grated""},{""ing_group"":""1 tsp rapeseed oil""},{""ing_group"":""1 onion (160g), finely chopped""},{""ing_group"":""1 red pepper , deseeded and finely diced (270g)""},{""ing_group"":""2 tsp balsamic vinegar""},{""ing_group"":""1 tsp vegetable bouillon powder""},{""ing_group"":""400g can chopped tomatoes""},{""ing_group"":""½ x 30g pack basil , leaves picked and finely chopped""},{""ing_group"":""1 garlic clove , finely grated""},{""ing_group"":""280g pack skinless cod loins""},{""ing_group"":""100g frozen small Atlantic cooked prawns , defrosted""},{""ing_group"":""160g broccoli florets""}]"
"1614336335-5000","https://www.bbcgoodfood.com/recipes/collection/easy-summer-recipes","Page 4","https://www.bbcgoodfood.com/recipes/collection/easy-summer-recipes/4","Cheesy seafood bake","https://www.bbcgoodfood.com/recipes/cheesy-seafood-bake","Cheesy seafood bake","","","[{""meth_group"":""STEP 1""},{""meth_group"":""Boil the potato slices for 10 mins then drain, tip into a bowl and gently mix in the milk and half the cheese. Don’t worry if the potatoes break up a little.""},{""meth_group"":""STEP 2""},{""meth_group"":""Meanwhile, heat the oil in a large frying pan and cook the onion until softened. Stir in the pepper and cook for 5 mins more. Spoon in the balsamic vinegar and bouillon powder, then stir in the tomatoes, basil and garlic. Lay the cod fillets on top, then cover and cook for 6-8 mins until the cod flakes when tested. Heat the grill to high.""},{""meth_group"":""STEP 3""},{""meth_group"":""Take off the heat, stir in the prawns and tip into a shallow baking dish, breaking up the cod into large chunks. Cover with the potatoes and sprinkle with the remaining cheese. Grill until golden. While it’s grilling, steam or boil the broccoli to serve with the bake.""}]","[{""ing_group"":""300g medium potatoes (about 3), thinly sliced""},{""ing_group"":""2 tbsp milk""},{""ing_group"":""40g mature cheddar , finely grated""},{""ing_group"":""1 tsp rapeseed oil""},{""ing_group"":""1 onion (160g), finely chopped""},{""ing_group"":""1 red pepper , deseeded and finely diced (270g)""},{""ing_group"":""2 tsp balsamic vinegar""},{""ing_group"":""1 tsp vegetable bouillon powder""},{""ing_group"":""400g can chopped tomatoes""},{""ing_group"":""½ x 30g pack basil , leaves picked and finely chopped""},{""ing_group"":""1 garlic clove , finely grated""},{""ing_group"":""280g pack skinless cod loins""},{""ing_group"":""100g frozen small Atlantic cooked prawns , defrosted""},{""ing_group"":""160g broccoli florets""}]"
"1614336423-5057","https://www.bbcgoodfood.com/recipes/collection/easy-summer-recipes","Page 4","https://www.bbcgoodfood.com/recipes/collection/easy-summer-recipes/4","Bean, feta & herb dip","https://www.bbcgoodfood.com/recipes/bean-feta-herb-dip","Bean, feta & herb dip","","","[{""meth_group"":""STEP 1""},{""meth_group"":""Drain and rinse beans. Tip into a food processor with feta, lemon juice and garlic, and whizz until smooth. Add dill, mint or chives, and season with pepper.""}]","[{""ing_group"":""400g can cannellini bean""},{""ing_group"":""200g feta cheese""},{""ing_group"":""1 tbsp lemon juice""},{""ing_group"":""1 garlic clove , crushed""},{""ing_group"":""3 tbsp chopped dill, mint or  chives (or 1 tbsp each)""}]"
"1614336530-5086","https://www.bbcgoodfood.com/recipes/collection/easy-summer-recipes","Page 2","https://www.bbcgoodfood.com/recipes/collection/easy-summer-recipes/2","Summer egg salad with basil & peas","https://www.bbcgoodfood.com/recipes/summer-egg-salad-basil-peas","","[{""ingr_list"":""150g new potatoes , thickly sliced""},{""ingr_list"":""160g French beans , trimmed""},{""ingr_list"":""160g frozen peas""},{""ingr_list"":""3 eggs""},{""ingr_list"":""160g romaine lettuce , roughly torn into pieces""},{""ingr_list"":""1 tbsp extra virgin olive oil""},{""ingr_list"":""2 tsp cider vinegar""},{""ingr_list"":""½ tsp English mustard powder""},{""ingr_list"":""2 tbsp chopped mint""},{""ingr_list"":""3 tbsp chopped basil""},{""ingr_list"":""1 garlic clove , finely grated""},{""ingr_list"":""1 tbsp capers""}]","","[{""meth_group"":""STEP 1""},{""meth_group"":""Cook the potatoes in a pan of simmering water for 5 mins. Add the beans and cook 5 mins more, then tip in the peas and cook for 2 mins until all the vegetables are just tender. Meanwhile, boil the eggs in another pan for 8 mins. Drain and run under cold water, then carefully shell and halve.""},{""meth_group"":""STEP 2""},{""meth_group"":""Mix all the dressing ingredients together in a large bowl with a good grinding of black pepper, crushing the herbs and capers with the back of a spoon to intensify their flavours.""},{""meth_group"":""STEP 3""},{""meth_group"":""Mix the warm vegetables into the dressing to coat, then add the lettuce and toss everything together. Pile onto plates, top with the eggs and grind over some black pepper to serve.""}]","[{""ing_group"":""150g new potatoes , thickly sliced""},{""ing_group"":""160g French beans , trimmed""},{""ing_group"":""160g frozen peas""},{""ing_group"":""3 eggs""},{""ing_group"":""160g romaine lettuce , roughly torn into pieces""},{""ing_group"":""1 tbsp extra virgin olive oil""},{""ing_group"":""2 tsp cider vinegar""},{""ing_group"":""½ tsp English mustard powder""},{""ing_group"":""2 tbsp chopped mint""},{""ing_group"":""3 tbsp chopped basil""},{""ing_group"":""1 garlic clove , finely grated""},{""ing_group"":""1 tbsp capers""}]"
"1614336509-5070","https://www.bbcgoodfood.com/recipes/collection/easy-summer-recipes","Page 2","https://www.bbcgoodfood.com/recipes/collection/easy-summer-recipes/2","Pepper & lemon spaghetti with basil & pine nuts","https://www.bbcgoodfood.com/recipes/pepper-lemon-spaghetti-basil-pine-nuts","Pepper & lemon spaghetti with basil & pine nuts","","","[{""meth_group"":""STEP 1""},{""meth_group"":""Heat the oil in a large non-stick frying pan. Add the pepper and cook for 5 mins. Meanwhile, cook the pasta for 10-12 mins until tender.""},{""meth_group"":""STEP 2""},{""meth_group"":""Add the courgette and garlic to the pepper and cook, stirring very frequently, for 10-15 mins until the courgette is really soft.""},{""meth_group"":""STEP 3""},{""meth_group"":""Stir in the lemon zest and juice, basil and spaghetti (reserve some pasta water) and toss together, adding a little of the pasta water until nicely coated. Add the pine nuts, then spoon into bowls and serve topped with the parmesan, if using.""}]","[{""ing_group"":""1 tbsp rapeseed oil""},{""ing_group"":""1 red pepper , deseeded and diced""},{""ing_group"":""150g wholemeal spaghetti""},{""ing_group"":""2 courgettes (250g), grated""},{""ing_group"":""2 garlic cloves , finely grated""},{""ing_group"":""1 lemon , zested and juiced""},{""ing_group"":""15g basil , finely chopped""},{""ing_group"":""25g pine nuts , toasted""},{""ing_group"":""2 tbsp finely grated parmesan or vegetarian alternative (optional)""}]"
"1614336267-4958","https://www.bbcgoodfood.com/recipes/collection/easy-summer-recipes","","","Summer berry cake with rose geranium cream","https://www.bbcgoodfood.com/recipes/summer-berry-cake-rose-geranium-cream","","[{""ingr_list"":""325g butter , at room temperature, plus extra for the tins""},{""ingr_list"":""425g caster sugar""},{""ingr_list"":""2 tsp almond extract""},{""ingr_list"":""½ lemon , finely zested""},{""ingr_list"":""250g plain yogurt""},{""ingr_list"":""4 large eggs , at room temperature""},{""ingr_list"":""375g self-raising flour""},{""ingr_list"":""225g ground almonds""},{""ingr_list"":""200g mascarpone""},{""ingr_list"":""300ml double cream""},{""ingr_list"":""1 tbsp lemon juice""},{""ingr_list"":""icing sugar , to taste, plus extra for dusting""},{""ingr_list"":""1-2 tsp rose geranium water or rose water, to taste (see tip, below)""},{""ingr_list"":""800g summer berries (raspberries, blackberries, redcurrants, blackcurrants, hulled strawberries and loganberries)""},{""ingr_list"":""4 tbsp caster sugar""},{""ingr_list"":""rose geranium flowers or other edible flowers""}]","","[{""meth_group"":""STEP 1""},{""meth_group"":""Heat oven to 180C/160C fan/gas 4. Butter and line the bases of three 23cm cake tins. Cream the butter and sugar until light and fluffy, then add the almond extract and lemon zest. Use a fork to whisk the yogurt with the eggs. With the mixer on a low speed, add the flour, ground almonds and 1/2 tsp salt to the butter and sugar, alternating with the yogurt and eggs.""},{""meth_group"":""STEP 2""},{""meth_group"":""Divide the batter between the tins and bake for 35-40 mins or until a skewer inserted into the middle comes out clean. Cool in the tins for 5 mins, then turn out onto a wire rack, remove the parchment and leave to cool.""},{""meth_group"":""STEP 3""},{""meth_group"":""Beat the mascarpone to loosen it. Whip the cream until it holds its shape. Combine the cream, mascarpone and lemon juice, then carefully add the icing sugar and flower water to taste.""},{""meth_group"":""STEP 4""},{""meth_group"":""Assemble the cake just before serving. Toss the berries with the caster sugar. Spread the flattest cake with half the cream, then add half the fruit. Top with a second cake, spread with the rest of the cream and top with the rest of the fruit. Finish with the last cake, sift over icing sugar, then decorate with rose geranium petals and rose geranium leaves (as long as they’re small).""}]","[{""ing_group"":""325g butter , at room temperature, plus extra for the tins""},{""ing_group"":""425g caster sugar""},{""ing_group"":""2 tsp almond extract""},{""ing_group"":""½ lemon , finely zested""},{""ing_group"":""250g plain yogurt""},{""ing_group"":""4 large eggs , at room temperature""},{""ing_group"":""375g self-raising flour""},{""ing_group"":""225g ground almonds""},{""ing_group"":""200g mascarpone""},{""ing_group"":""300ml double cream""},{""ing_group"":""1 tbsp lemon juice""},{""ing_group"":""icing sugar , to taste, plus extra for dusting""},{""ing_group"":""1-2 tsp rose geranium water or rose water, to taste (see tip, below)""},{""ing_group"":""800g summer berries (raspberries, blackberries, redcurrants, blackcurrants, hulled strawberries and loganberries)""},{""ing_group"":""4 tbsp caster sugar""},{""ing_group"":""rose geranium flowers or other edible flowers""}]"
"1614336382-5030","https://www.bbcgoodfood.com/recipes/collection/easy-summer-recipes","Page 4","https://www.bbcgoodfood.com/recipes/collection/easy-summer-recipes/4","Easy vanilla cupcakes","https://www.bbcgoodfood.com/recipes/easy-vanilla-cupcakes","Easy vanilla cupcakes","","","[{""meth_group"":""STEP 1""},{""meth_group"":""Heat oven to 180C/160C fan/gas 4. Line 12 holes in a shallow muffin tin with cupcake cases (not muffin cases). Cream the butter and sugar together until the mixture is light and fluffy. Beat the eggs and vanilla in a jug, then beat into the butter mixture a little at a time.""},{""meth_group"":""STEP 2""},{""meth_group"":""Fold the flour into the mixture along with a little milk – the mixture should fall easily off a spoon. Divide the mixture between the cases, filling each one no more than half full.""},{""meth_group"":""STEP 3""},{""meth_group"":""Cook the cakes for 12-15 mins – they should be firm to the touch and slightly golden brown. Cool in the tin for 5 mins, then lift them out gently and leave to cool completely.""},{""meth_group"":""STEP 4""},{""meth_group"":""To make the icing, beat the butter until it is very soft. Beat in the icing sugar a little at a time, then beat in a splash of the milk as you need to give you a soft icing that can be piped easily. Scrape the icing into an icing bag fitted with a star nozzle. Ice the cakes in swirls, starting in the centre and working outwards.""}]","[{""ing_group"":""110g butter , softened""},{""ing_group"":""110g golden caster sugar""},{""ing_group"":""2 eggs""},{""ing_group"":""1 tsp vanilla extract""},{""ing_group"":""110g self-raising flour""},{""ing_group"":""1-2 tbsp milk , plus a little extra for the icing""},{""ing_group"":""125g butter , softened""},{""ing_group"":""185g icing sugar""}]"
