web-scraper-order,web-scraper-start-url,pagination,pagination-href,recip,recip-href,name,ingr_list,meth_list,meth_group,ing_group
"1614336359-5016","https://www.bbcgoodfood.com/recipes/collection/easy-summer-recipes","Page 4","https://www.bbcgoodfood.com/recipes/collection/easy-summer-recipes/4","Salted tomato salad","https://www.bbcgoodfood.com/recipes/salted-tomato-salad","","[{""ingr_list"":""300g heritage tomatoes , various shapes and sizes""},{""ingr_list"":""1 red onion""},{""ingr_list"":""1 garlic clove""},{""ingr_list"":""8 small basil leaves""},{""ingr_list"":""1 tbsp olive oil""},{""ingr_list"":""1 tbsp nigella seeds""}]","","[{""meth_group"":""STEP 1""},{""meth_group"":""Chop the tomatoes into equal-sized chunks and slice the onion, then transfer them to a bowl. Grate the garlic, then add to the tomatoes, along with the basil leaves.""},{""meth_group"":""STEP 2""},{""meth_group"":""Sprinkle with ½ tsp salt, pour over the oil and toss together. Leave to infuse for up to 30 mins, then serve sprinkled with nigella seeds.""}]","[{""ing_group"":""300g heritage tomatoes , various shapes and sizes""},{""ing_group"":""1 red onion""},{""ing_group"":""1 garlic clove""},{""ing_group"":""8 small basil leaves""},{""ing_group"":""1 tbsp olive oil""},{""ing_group"":""1 tbsp nigella seeds""}]"
"1614336262-4956","https://www.bbcgoodfood.com/recipes/collection/easy-summer-recipes","","","Roasted asparagus & pea salad","https://www.bbcgoodfood.com/recipes/roasted-asparagus-pea-salad","","","[{""meth_list"":""STEP 1""},{""meth_list"":""Heat oven to 220C/200C fan/gas 7. Mix the yogurt, mustard and honey together. Add the lemon zest, then add the juice and some seasoning to taste. Squeeze any remaining lemon juice over the watercress.""},{""meth_list"":""STEP 2""},{""meth_list"":""Tear the bread into rough chunks and put them on a large roasting tray with the asparagus. Toss both in the rapeseed oil and seasoning, and roast for 10 mins until the asparagus is tender and croutons are golden.""},{""meth_list"":""STEP 3""},{""meth_list"":""Meanwhile, cook the eggs in a pan of boiling water for 6 mins, then add the frozen peas and cook for 1 min more. Drain and rinse both under cold water until cool. Peel the eggs, then cut into quarters.""},{""meth_list"":""STEP 4""},{""meth_list"":""To assemble, mix the asparagus and peas through the watercress, then toss through the creamy dressing. Nestle in the eggs and croutons, and serve.""}]","[{""meth_group"":""STEP 1""},{""meth_group"":""Heat oven to 220C/200C fan/gas 7. Mix the yogurt, mustard and honey together. Add the lemon zest, then add the juice and some seasoning to taste. Squeeze any remaining lemon juice over the watercress.""},{""meth_group"":""STEP 2""},{""meth_group"":""Tear the bread into rough chunks and put them on a large roasting tray with the asparagus. Toss both in the rapeseed oil and seasoning, and roast for 10 mins until the asparagus is tender and croutons are golden.""},{""meth_group"":""STEP 3""},{""meth_group"":""Meanwhile, cook the eggs in a pan of boiling water for 6 mins, then add the frozen peas and cook for 1 min more. Drain and rinse both under cold water until cool. Peel the eggs, then cut into quarters.""},{""meth_group"":""STEP 4""},{""meth_group"":""To assemble, mix the asparagus and peas through the watercress, then toss through the creamy dressing. Nestle in the eggs and croutons, and serve.""}]","[{""ing_group"":""3 tbsp natural yogurt""},{""ing_group"":""1 tsp wholegrain mustard""},{""ing_group"":""½ tsp honey""},{""ing_group"":""½ lemon , zested and juiced""},{""ing_group"":""100g watercress""},{""ing_group"":""1 large slice sourdough bread""},{""ing_group"":""200g asparagus , tough ends removed""},{""ing_group"":""1 ½ tbsp cold-pressed rapeseed oil""},{""ing_group"":""2 eggs""},{""ing_group"":""200g frozen peas""}]"
"1614336355-5013","https://www.bbcgoodfood.com/recipes/collection/easy-summer-recipes","Page 4","https://www.bbcgoodfood.com/recipes/collection/easy-summer-recipes/4","Apricot & pistachio frangipane blondies","https://www.bbcgoodfood.com/recipes/apricot-pistachio-frangipane-blondies","","[{""ingr_list"":""100g unsalted butter , melted, plus a little extra for the tin""},{""ingr_list"":""200g light muscovado sugar""},{""ingr_list"":""½ tsp fennel seeds""},{""ingr_list"":""1 large egg""},{""ingr_list"":""120g plain flour""},{""ingr_list"":""50g pistachios , roughly chopped""},{""ingr_list"":""1-2 tbsp milk""},{""ingr_list"":""6 large ripe apricots , halved and stoned""},{""ingr_list"":""65g golden caster sugar""},{""ingr_list"":""80g unsalted butter , softened""},{""ingr_list"":""1 egg""},{""ingr_list"":""100g pistachios , ground to crumbs""}]","","[{""meth_group"":""STEP 1""},{""meth_group"":""Heat oven to 200C/180C fan/gas 6 and butter and line a rectangular baking tin, approx 20 x 25cm. To make the frangipane, beat together the sugar and butter until fluffy, then add the egg and pistachios.""},{""meth_group"":""STEP 2""},{""meth_group"":""In a bowl, stir together the muscovado sugar, fennel seeds and melted butter with a pinch of salt. Add the egg and stir vigorously, then tip in the flour and half the pistachios and fold until well combined and no streaks remain. Add the milk to loosen.""},{""meth_group"":""STEP 3""},{""meth_group"":""Spoon two-thirds of the batter into the tin and smooth with the back of a metal spoon or spatula, then arrange the apricot halves on top and press into the batter. Dot the frangipane around the batter too, then top with the remaining spoonfuls of batter so that it’s part covering the frangipane and apricots. Scatter over the rest of the pistachios. Bake for 25-30 mins until a skewer comes out with some crumbs that are a little moist, but not raw. Cool completely in the tin, then cut into 12 squares.""}]","[{""ing_group"":""100g unsalted butter , melted, plus a little extra for the tin""},{""ing_group"":""200g light muscovado sugar""},{""ing_group"":""½ tsp fennel seeds""},{""ing_group"":""1 large egg""},{""ing_group"":""120g plain flour""},{""ing_group"":""50g pistachios , roughly chopped""},{""ing_group"":""1-2 tbsp milk""},{""ing_group"":""6 large ripe apricots , halved and stoned""},{""ing_group"":""65g golden caster sugar""},{""ing_group"":""80g unsalted butter , softened""},{""ing_group"":""1 egg""},{""ing_group"":""100g pistachios , ground to crumbs""}]"
"1614336330-4999","https://www.bbcgoodfood.com/recipes/collection/easy-summer-recipes","Page 4","https://www.bbcgoodfood.com/recipes/collection/easy-summer-recipes/4","Strawberry, feta & thyme tart","https://www.bbcgoodfood.com/recipes/strawberry-feta-thyme-tart","","","[{""meth_list"":""STEP 1""},{""meth_list"":""Heat the oven to 200C/180C fan/gas 6, and put a baking sheet in the oven to warm up.""},{""meth_list"":""STEP 2""},{""meth_list"":""Mash the crème fraîche, thyme, feta, garlic, lemon, chilli and some seasoning in a bowl with a fork until fairly smooth.""},{""meth_list"":""STEP 3""},{""meth_list"":""Unravel the pastry onto a piece of baking parchment and score a 1cm border around the edge with a sharp knife. Spread the crème fraîche mixture onto the tart, smoothing over up to the border edges. Scatter the strawberry slices over and bake for 25 mins until golden and puffed up. Scatter over more thyme leaves and serve with a rocket salad and a chilled glass of rosé.""}]","[{""meth_group"":""STEP 1""},{""meth_group"":""Heat the oven to 200C/180C fan/gas 6, and put a baking sheet in the oven to warm up.""},{""meth_group"":""STEP 2""},{""meth_group"":""Mash the crème fraîche, thyme, feta, garlic, lemon, chilli and some seasoning in a bowl with a fork until fairly smooth.""},{""meth_group"":""STEP 3""},{""meth_group"":""Unravel the pastry onto a piece of baking parchment and score a 1cm border around the edge with a sharp knife. Spread the crème fraîche mixture onto the tart, smoothing over up to the border edges. Scatter the strawberry slices over and bake for 25 mins until golden and puffed up. Scatter over more thyme leaves and serve with a rocket salad and a chilled glass of rosé.""}]","[{""ing_group"":""100g crème fraîche""},{""ing_group"":""3 thyme sprigs, leaves picked, plus extra to serve""},{""ing_group"":""100g vegetarian feta , crumbled""},{""ing_group"":""1⁄2 garlic clove , crushed""},{""ing_group"":""1⁄2 lemon , zested""},{""ing_group"":""pinch chilli flakes""},{""ing_group"":""1 sheet ready rolled puff pastry (about 320g)""},{""ing_group"":""200g strawberries , sliced""},{""ing_group"":""rocket salad , to serve (optional)""}]"
"1614336535-5088","https://www.bbcgoodfood.com/recipes/collection/easy-summer-recipes","Page 2","https://www.bbcgoodfood.com/recipes/collection/easy-summer-recipes/2","Tear-and-share cheese & garlic rolls","https://www.bbcgoodfood.com/recipes/tear-and-share-cheese-garlic-rolls","Tear-and-share cheese & garlic rolls","","","[{""meth_group"":""STEP 1""},{""meth_group"":""Heat 280ml water in a saucepan for a minute until warm but not too hot to stick your finger in (don’t burn yourself!). Remove from the heat, then add 50g butter. Combine the flour, yeast, sugar and 1 tsp salt in a large bowl or a tabletop mixer. Add the warm water and beat to make a soft dough. Knead for 10 mins by hand, or 5 mins in a mixer, until the dough feels stretchy and smooth. Tip into a clean, oiled bowl and cover with oiled cling film. Leave to rise for 1½-2 hrs, or until doubled in size.""},{""meth_group"":""STEP 2""},{""meth_group"":""Brush a large baking tray with oil and scatter over the polenta. Knock the air out of the dough. Pinch off small pieces (about the size of a walnut), then roll each piece into a ball and put on the baking tray. Leave a little space between each dough ball.""},{""meth_group"":""STEP 3""},{""meth_group"":""Heat oven to 180C/160C fan/gas 4. Cover the tray with oiled cling film, then prove for 30 mins-1 hr until the dough has doubled in size and the balls are touching. Mix the remaining butter with the garlic. When the rolls are ready to cook, brush the tops with the garlic butter and scatter with the cheeses. Bake for 25-30 mins until the dough balls are cooked through. Leave to cool for 5 mins, then serve.""}]","[{""ing_group"":""100g unsalted butter , softened""},{""ing_group"":""450g strong white bread flour""},{""ing_group"":""7g sachet fast-action dried yeast""},{""ing_group"":""1 tsp golden caster sugar""},{""ing_group"":""rapeseed oil , for the bowl and tray""},{""ing_group"":""2 tbsp polenta or cornmeal""},{""ing_group"":""1 garlic clove , grated""},{""ing_group"":""100g mozzarella , grated""},{""ing_group"":""50g cheddar , grated""}]"
"1614336239-4940","https://www.bbcgoodfood.com/recipes/collection/easy-summer-recipes","","","Salmon picnic platter","https://www.bbcgoodfood.com/recipes/salmon-picnic-platter","","[{""ingr_list"":""4 eggs""},{""ingr_list"":""2-3 tbsp mayonnaise""},{""ingr_list"":""a little cayenne pepper""},{""ingr_list"":""200g cooked salmon""},{""ingr_list"":""100g hot-smoked salmon""},{""ingr_list"":""6 small rolls , halved""},{""ingr_list"":""3 tbsp cream cheese""},{""ingr_list"":""100g smoked salmon""},{""ingr_list"":""1 lemon , 1/2 zested and 1/2 cut into wedges""},{""ingr_list"":""½ cucumber""},{""ingr_list"":""2 tbsp Greek yogurt""},{""ingr_list"":""1 tbsp chopped dill or chives""},{""ingr_list"":""bread , soft rolls or wraps, to serve""}]","","[{""meth_group"":""STEP 1""},{""meth_group"":""Hard boil the eggs by cooking them in boiling water for 8 mins, then cool quickly under cold running water and peel. Halve the eggs and pop the yolks into a bowl. Mash the yolks with the mayonnaise, cayenne pepper and some seasoning. Spoon or pipe the mixture back into the egg halves and chill until you need them.""},{""meth_group"":""STEP 2""},{""meth_group"":""Flake the cooked salmon into large chunks and put it on a platter with the hot-smoked salmon and the eggs.""},{""meth_group"":""STEP 3""},{""meth_group"":""Spread the bottom half of the rolls with cream cheese, then add the smoked salmon and a squeeze of lemon juice and top with the other half of the roll. Cut each one in half.""},{""meth_group"":""STEP 4""},{""meth_group"":""Peel and slice the cucumber. Mix the yogurt with the dill, lemon zest and some seasoning, then stir in the cucumber. Pile the mixture into the centre of the platter. Serve with extra bread, rolls or wraps and lemon wedges.""}]","[{""ing_group"":""4 eggs""},{""ing_group"":""2-3 tbsp mayonnaise""},{""ing_group"":""a little cayenne pepper""},{""ing_group"":""200g cooked salmon""},{""ing_group"":""100g hot-smoked salmon""},{""ing_group"":""6 small rolls , halved""},{""ing_group"":""3 tbsp cream cheese""},{""ing_group"":""100g smoked salmon""},{""ing_group"":""1 lemon , 1/2 zested and 1/2 cut into wedges""},{""ing_group"":""½ cucumber""},{""ing_group"":""2 tbsp Greek yogurt""},{""ing_group"":""1 tbsp chopped dill or chives""},{""ing_group"":""bread , soft rolls or wraps, to serve""}]"
"1614336544-5094","https://www.bbcgoodfood.com/recipes/collection/easy-summer-recipes","Page 2","https://www.bbcgoodfood.com/recipes/collection/easy-summer-recipes/2","Vegan vanilla ice cream","https://www.bbcgoodfood.com/recipes/vegan-vanilla-ice-cream","Vegan vanilla ice cream","","","[{""meth_group"":""STEP 1""},{""meth_group"":""Pour most of the coconut milk into a saucepan, reserving a splash in a small bowl for later. Add the sugar, salt and turmeric (for colour) to the pan. Cut the vanilla pod in half lengthways (if using) and scrape the seeds out of both sides with the side of the knife. Put the seeds and the pod, or vanilla paste, into the pan. Warm on a low heat for 10 mins until the sugar has melted and the mixture starts to steam.""},{""meth_group"":""STEP 2""},{""meth_group"":""Mix the cornflour with the reserved coconut milk in a small bowl until smooth. Pour into the hot milk, and continually whisking, heat for another 5-10 mins until the mixture thickens to a pourable custard consistency. Strain into a bowl, and cover. Leave to cool, then chill for at least 2 hrs.""},{""meth_group"":""STEP 3""},{""meth_group"":""Pour the chilled mix into an ice cream maker, and churn for 20-30 mins until you get a soft scoop ice cream. Transfer to a sealable container and freeze for up to 3 months until ready to serve. If you don’t have an ice cream maker, pour the chilled mix into a wide-based plastic tub or dish. Freeze for 2-3 hrs, stirring the mix every 20 mins with a fork, to break up any large ice crystals, until soft ice cream. Transfer to a smaller tub and freeze until ready to serve. You should be able to scoop the ice cream easily from the freezer, or leave for a few mins at room temperature to soften, if you need to.""}]","[{""ing_group"":""2 x 400g cans coconut milk (not light)""},{""ing_group"":""175g caster sugar""},{""ing_group"":""1 tsp sea salt flakes""},{""ing_group"":""1 vanilla pod or 1 tbsp vanilla bean paste""},{""ing_group"":""2 tbsp cornflour""},{""ing_group"":""a pinch turmeric""}]"
"1614336539-5092","https://www.bbcgoodfood.com/recipes/collection/easy-summer-recipes","Page 2","https://www.bbcgoodfood.com/recipes/collection/easy-summer-recipes/2","Lamb kebab burger","https://www.bbcgoodfood.com/recipes/lamb-kebab-burger","","[{""ingr_list"":""2 tbsp fat-free yogurt""},{""ingr_list"":""1 tbsp mayonnaise""},{""ingr_list"":""1 small  garlic clove , grated""},{""ingr_list"":""½ tbsp vegetable oil""},{""ingr_list"":""2 lamb burgers""},{""ingr_list"":""2 sesame seed burger buns""},{""ingr_list"":""1 tomato , sliced""},{""ingr_list"":""20g gherkins , sliced""},{""ingr_list"":""1 red chilli , finely sliced""},{""ingr_list"":""leaves of 1 Baby Gem lettuce""}]","","[{""meth_group"":""STEP 1""},{""meth_group"":""Combine the yogurt with the mayonnaise and grated garlic in a small bowl. Heat the vegetable oil in a non-stick frying pan over a medium heat, add the lamb burgers and fry for around 10 mins, turning over halfway through, until piping hot in the centre. Lightly toast the burger buns. Divide the sliced tomato, sliced gherkins, the burgers, some garlic sauce, chilli and the lettuce leaves between each burger bun, then enjoy immediately.""}]","[{""ing_group"":""2 tbsp fat-free yogurt""},{""ing_group"":""1 tbsp mayonnaise""},{""ing_group"":""1 small  garlic clove , grated""},{""ing_group"":""½ tbsp vegetable oil""},{""ing_group"":""2 lamb burgers""},{""ing_group"":""2 sesame seed burger buns""},{""ing_group"":""1 tomato , sliced""},{""ing_group"":""20g gherkins , sliced""},{""ing_group"":""1 red chilli , finely sliced""},{""ing_group"":""leaves of 1 Baby Gem lettuce""}]"
"1614336387-5035","https://www.bbcgoodfood.com/recipes/collection/easy-summer-recipes","Page 4","https://www.bbcgoodfood.com/recipes/collection/easy-summer-recipes/4","Mashed cannellini beans with wilted greens & fried artichokes","https://www.bbcgoodfood.com/recipes/mashed-cannellini-beans-wilted-greens-fried-artichokes","","","[{""meth_list"":""STEP 1""},{""meth_list"":""Warm 1 tbsp olive oil in a saucepan over a medium heat. Add the garlic, thyme, a pinch of salt and the chilli flakes, and cook for 1 min or so. Tip in the beans, then add a slosh of their water and the juice of 1/2 a lemon. Cook for a few mins, crushing them with a fork or the back of a wooden spoon. Remove from the heat and discard the springs of thyme. Keep warm.""},{""meth_list"":""STEP 2""},{""meth_list"":""Heat a little olive oil in a non-stick frying pan with a lid. Add the greens and a pinch of salt, then put the lid on to wilt and steam the greens for a few mins until softened. Season and add some of the lemon juice, and tip into a bowl. Keep warm.""},{""meth_list"":""STEP 3""},{""meth_list"":""Heat 2 tbsp olive oil in the frying pan you used for the greens. Put the semolina flour in a bowl and season. Drain the artichokes and pat them dry with kitchen paper. Dip each one in the flour and put in the pan to shallow fry, turning halfway through, until crisp and golden, around 3-5 mins. Spoon the cannellini beans onto a plate and top with the wilted greens and artichokes. Garnish with lemon zest, rosemary, grated parmesan and extra lemon wedges on the side.""}]","[{""meth_group"":""STEP 1""},{""meth_group"":""Warm 1 tbsp olive oil in a saucepan over a medium heat. Add the garlic, thyme, a pinch of salt and the chilli flakes, and cook for 1 min or so. Tip in the beans, then add a slosh of their water and the juice of 1/2 a lemon. Cook for a few mins, crushing them with a fork or the back of a wooden spoon. Remove from the heat and discard the springs of thyme. Keep warm.""},{""meth_group"":""STEP 2""},{""meth_group"":""Heat a little olive oil in a non-stick frying pan with a lid. Add the greens and a pinch of salt, then put the lid on to wilt and steam the greens for a few mins until softened. Season and add some of the lemon juice, and tip into a bowl. Keep warm.""},{""meth_group"":""STEP 3""},{""meth_group"":""Heat 2 tbsp olive oil in the frying pan you used for the greens. Put the semolina flour in a bowl and season. Drain the artichokes and pat them dry with kitchen paper. Dip each one in the flour and put in the pan to shallow fry, turning halfway through, until crisp and golden, around 3-5 mins. Spoon the cannellini beans onto a plate and top with the wilted greens and artichokes. Garnish with lemon zest, rosemary, grated parmesan and extra lemon wedges on the side.""}]","[{""ing_group"":""4 tbsp olive oil""},{""ing_group"":""1 garlic clove , crushed""},{""ing_group"":""2 thyme sprigs""},{""ing_group"":""pinch of red chilli flakes""},{""ing_group"":""400g can cannellini beans , drained, 1 tbsp of can water reserved""},{""ing_group"":""1 lemon , zested and juiced, plus wedges to serve""},{""ing_group"":""200g mixed seasonal greens (I used spinach, watercress, sorrel and rocket)""},{""ing_group"":""2 tbsp semolina flour""},{""ing_group"":""100g cooked artichoke hearts , in oil""},{""ing_group"":""few rosemary sprigs , finely chopped (optional)""},{""ing_group"":""parmesan or vegetarian alternative, to serve""}]"
"1614336387-5033","https://www.bbcgoodfood.com/recipes/collection/easy-summer-recipes","Page 4","https://www.bbcgoodfood.com/recipes/collection/easy-summer-recipes/4","Mashed cannellini beans with wilted greens & fried artichokes","https://www.bbcgoodfood.com/recipes/mashed-cannellini-beans-wilted-greens-fried-artichokes","Mashed cannellini beans with wilted greens & fried artichokes","","","[{""meth_group"":""STEP 1""},{""meth_group"":""Warm 1 tbsp olive oil in a saucepan over a medium heat. Add the garlic, thyme, a pinch of salt and the chilli flakes, and cook for 1 min or so. Tip in the beans, then add a slosh of their water and the juice of 1/2 a lemon. Cook for a few mins, crushing them with a fork or the back of a wooden spoon. Remove from the heat and discard the springs of thyme. Keep warm.""},{""meth_group"":""STEP 2""},{""meth_group"":""Heat a little olive oil in a non-stick frying pan with a lid. Add the greens and a pinch of salt, then put the lid on to wilt and steam the greens for a few mins until softened. Season and add some of the lemon juice, and tip into a bowl. Keep warm.""},{""meth_group"":""STEP 3""},{""meth_group"":""Heat 2 tbsp olive oil in the frying pan you used for the greens. Put the semolina flour in a bowl and season. Drain the artichokes and pat them dry with kitchen paper. Dip each one in the flour and put in the pan to shallow fry, turning halfway through, until crisp and golden, around 3-5 mins. Spoon the cannellini beans onto a plate and top with the wilted greens and artichokes. Garnish with lemon zest, rosemary, grated parmesan and extra lemon wedges on the side.""}]","[{""ing_group"":""4 tbsp olive oil""},{""ing_group"":""1 garlic clove , crushed""},{""ing_group"":""2 thyme sprigs""},{""ing_group"":""pinch of red chilli flakes""},{""ing_group"":""400g can cannellini beans , drained, 1 tbsp of can water reserved""},{""ing_group"":""1 lemon , zested and juiced, plus wedges to serve""},{""ing_group"":""200g mixed seasonal greens (I used spinach, watercress, sorrel and rocket)""},{""ing_group"":""2 tbsp semolina flour""},{""ing_group"":""100g cooked artichoke hearts , in oil""},{""ing_group"":""few rosemary sprigs , finely chopped (optional)""},{""ing_group"":""parmesan or vegetarian alternative, to serve""}]"
"1614336496-5063","https://www.bbcgoodfood.com/recipes/collection/easy-summer-recipes","Page 2","https://www.bbcgoodfood.com/recipes/collection/easy-summer-recipes/2","Frozen margarita","https://www.bbcgoodfood.com/recipes/frozen-margarita","","","[{""meth_list"":""STEP 1""},{""meth_list"":""Put all the ingredients except the lime wedge in a blender and blitz until smooth. Tip into a cocktail, margarita or rocks glass, garnish and serve.""}]","[{""meth_group"":""STEP 1""},{""meth_group"":""Put all the ingredients except the lime wedge in a blender and blitz until smooth. Tip into a cocktail, margarita or rocks glass, garnish and serve.""}]","[{""ing_group"":""50ml tequila""},{""ing_group"":""25ml triple sec (we used Cointreau)""},{""ing_group"":""25ml lime juice""},{""ing_group"":""15ml sugar syrup (see 'Goes well with' below)""},{""ing_group"":""large handful of ice""},{""ing_group"":""wedge of lime , to garnish""}]"
"1614336569-5111","https://www.bbcgoodfood.com/recipes/collection/easy-summer-recipes","Page 2","https://www.bbcgoodfood.com/recipes/collection/easy-summer-recipes/2","Strawberry shortbread ice cream sandwich","https://www.bbcgoodfood.com/recipes/strawberry-shortbread-ice-cream-sandwich","","","[{""meth_list"":""STEP 1""},{""meth_list"":""Mix the ice cream with the strawberries and freeze until solid.""},{""meth_list"":""STEP 2""},{""meth_list"":""Sandwich spoonfuls of the ice cream between the biscuits, then eat immediately.""}]","[{""meth_group"":""STEP 1""},{""meth_group"":""Mix the ice cream with the strawberries and freeze until solid.""},{""meth_group"":""STEP 2""},{""meth_group"":""Sandwich spoonfuls of the ice cream between the biscuits, then eat immediately.""}]","[{""ing_group"":""4 scoops strawberry cheesecake ice cream , softened""},{""ing_group"":""a few fresh strawberries , finely chopped""},{""ing_group"":""8 Viennese whirls (or shortbread biscuits)""}]"
